{
  "city": "深圳",
  "district": "福田区",
  "preferred_area": [
    "领展中心城",
    "深圳会展中心",
    "COCO Park酒吧街"
  ],
  "party_size": {
    "min": 4,
    "max": 6
  },
  "distance_km": {
    "min": 3.0,
    "max": 4.5
  },
  "duration_minutes": null,
  "convenience_store_target": {
    "min": 10,
    "max": 14
  },
  "start_hint": "领展中心城",
  "end_hint": "COCO Park酒吧街",
  "loop_preference": "one_way",
  "nightlife_priority": true,
  "route_count": 3,
  "map_aspect_ratio": "9:16",
  "language": "zh-CN"
}